1	As his roommate slept, Jim cleared his essay.	A6ORRFI3XOACA	38F71OA9GTW70F90X4HJAPDHGP5FMV
0	The funeral director sewed the body parts of the deceased.	AMI8H1U9OH4SM	37XITHEISW9RUJ2IBANZOIMOPYRCRI
1	The funeral director sold the body parts of the deceased.	AMI8H1U9OH4SM	37XITHEISW9RUJ2IBANZOIMOPYRCRI
0	Daniel and Alex decided to take advantage of some senior marketing positions.	A2D29YTN8FLONY	3WJ1OXY92AGXJZQOSNL8R61VZ5U8AG
1	Daniel and Alex decided to take advantage of some senior citizens.	A2D29YTN8FLONY	3WJ1OXY92AGXJZQOSNL8R61VZ5U8AG
0	They reported child and parents because they crossed the border.	A6ORRFI3XOACA	3HVVDCPGTESHD1GFBRAJLOFPG8NYT8
1	They distanced child from parents because they crossed the border.	A6ORRFI3XOACA	3HVVDCPGTESHD1GFBRAJLOFPG8NYT8
0	The girl threw the tissue in the trash can after she had used it.	A34QZDSTKZ3JO9	3TMSXRD2X60CFC96U78LULBEDI41WD
1	The girl threw the tissue in the pot on the stove after she had used it.	A34QZDSTKZ3JO9	3TMSXRD2X60CFC96U78LULBEDI41WD
0	The detective was yelling at the man during interrogation.	A2JBNDG0U9IA6I	3FE7TXL1LINEK0VG129T7F3XHLB2QX
1	The detective was assaulting the man during interrogation.	A2JBNDG0U9IA6I	3FE7TXL1LINEK0VG129T7F3XHLB2QX
0	Bob treated his friends to lunch after one of them helped land him a job	A4T4C70M9RVQG	3PB5A5BD0V6UTCY84ILC9SG3MFNG7X
1	Bob treated his friends like he didn't know them after one of them helped land him a job	A4T4C70M9RVQG	3PB5A5BD0V6UTCY84ILC9SG3MFNG7X
0	He wanted to catch the predator of little kids.	AMI8H1U9OH4SM	39N5ACM9HEN4K8F0MY9JHXL1IVBP9X
1	He wanted to watch the predator of little kids.	AMI8H1U9OH4SM	39N5ACM9HEN4K8F0MY9JHXL1IVBP9X
0	Josh called an ambulance to save Jeff	A4T4C70M9RVQG	3Y4W8Q93LZKTSIPDKQNK9LT9V5RDVP
1	Josh called an ambulance to win a bet	A4T4C70M9RVQG	3Y4W8Q93LZKTSIPDKQNK9LT9V5RDVP
0	She had a portrait of her grandfather on her desk at work, whom she woshipped.	AVF8EZOYPZKJ1	354P56DE9K3XJH7ZZIFTY6Z6APJ7S8
1	She had a portrait of Adolf Hitler on her desk at work, whom she woshipped.	AVF8EZOYPZKJ1	354P56DE9K3XJH7ZZIFTY6Z6APJ7S8
0	As his parents went out to dinner, Lea prepared a meal.	A6ORRFI3XOACA	3VNXK88KKCIHPSCW8AIINPAJ4KTV97
1	As his parents went out to dinner, Lea partied at home.	A6ORRFI3XOACA	3VNXK88KKCIHPSCW8AIINPAJ4KTV97
0	She smiled and poured some coffee for her 16 year old daughter.	AVF8EZOYPZKJ1	3WAKVUDHUWGDYUZ3ONATD7HUVM17UL
1	She smiled and poured some coffee for her 2 year old daughter.	AVF8EZOYPZKJ1	3WAKVUDHUWGDYUZ3ONATD7HUVM17UL
0	He was cleaning all the windows late at night.	A2JBNDG0U9IA6I	3TPWUS5F891W2FJ4A4X5BHU5HDYWCX
1	He was peeping in the windows late at night.	A2JBNDG0U9IA6I	3TPWUS5F891W2FJ4A4X5BHU5HDYWCX
0	The dad had alot of love for his son.	A2D29YTN8FLONY	3LPW2N6LKT2YBQLK0UVWFN3Y4H2U5R
1	The dad had alot of lust for his son.	A2D29YTN8FLONY	3LPW2N6LKT2YBQLK0UVWFN3Y4H2U5R
0	She used a frying pan to cook with her children.	A23VFKXKH67DNT	3E47SOBEYQWE1KZZLNTQAQLX24LIC1
1	She used a frying pan to discipline her children.	A23VFKXKH67DNT	3E47SOBEYQWE1KZZLNTQAQLX24LIC1
0	Pete followed his wife into the fitting room to watch her try on a new dress.	AVF8EZOYPZKJ1	3ON104KXQKWT7B6PHPRNSJIHP0ZW42
1	Pete followed some woman into the fitting room to watch her try on a new dress.	AVF8EZOYPZKJ1	3ON104KXQKWT7B6PHPRNSJIHP0ZW42
0	She fell asleep and he took her temperature.	A6ORRFI3XOACA	3TOK3KHVJTIILPF6S1YKE1P5D1NO71
1	She fell asleep and he read her Will.	A6ORRFI3XOACA	3TOK3KHVJTIILPF6S1YKE1P5D1NO71
0	While her parents were resting, she napped.	A6ORRFI3XOACA	3DPNQGW4LLFVDWRJQ7EJUPJ422P461
1	While her parents were resting, she beatboxed.	A6ORRFI3XOACA	3DPNQGW4LLFVDWRJQ7EJUPJ422P461
0	Because he was hungry, the child ate the cookie.	ABBHZO5O4SCPQ	35GCEFQ6I5OCJASQSY6BHIKTT54Z3E
1	Because he was hungry, the child took the cookie.	ABBHZO5O4SCPQ	35GCEFQ6I5OCJASQSY6BHIKTT54Z3E
0	Billy knew his overweight teacher was dieting, so he offered her a small yogurt.	A2HM35CWB7IIFM	3HHRAGRYX85MZ83Z7YW4SXGB9UN9OH
1	Billy knew his overweight teacher was dieting, so he offered her a big sundae.	A2HM35CWB7IIFM	3HHRAGRYX85MZ83Z7YW4SXGB9UN9OH
0	Let's eat, grandpa, said his daughter emily.	A2D29YTN8FLONY	37W3JXSD66895IK96WFU88MOL47WY3
1	Let's eat grandpa, said his daughter emily.	A2D29YTN8FLONY	37W3JXSD66895IK96WFU88MOL47WY3
0	Jerry yanked the carrot out of the ground	A4T4C70M9RVQG	3BDCF01OGXUTUO8A2I8SZX58NXRYL0
1	Jerry yanked Jeff hair out of his scalp	A4T4C70M9RVQG	3BDCF01OGXUTUO8A2I8SZX58NXRYL0
0	The lady went to the restroom, and the guy watched her purse.	A6ORRFI3XOACA	32KTQ2V7RDFYZ5INUIHR0TR6ET8M9D
1	The lady went to the restroom, and the guy lifted her purse.	A6ORRFI3XOACA	32KTQ2V7RDFYZ5INUIHR0TR6ET8M9D
0	She was pole dancing during the erotic show.	A2JBNDG0U9IA6I	3SITXWYCNV9SHAWO69XW2G2U9YXBX0
1	She was pole dancing during the puppet show.	A2JBNDG0U9IA6I	3SITXWYCNV9SHAWO69XW2G2U9YXBX0
0	Jane had PTSD, so her husband surprised her by washing the pots.	A2HM35CWB7IIFM	3483FV8BEEJLAICWMTVV1AM6IOR625
1	Jane had PTSD, so her husband surprised her by banging the pots.	A2HM35CWB7IIFM	3483FV8BEEJLAICWMTVV1AM6IOR625
0	The builder used sturdy materials to construct the skyscraper	A1DP4BJKMEF6LS	3KOPY89HM82MJVNMAC3PTOW3A8Y3J6
1	The builder used shoddy materials to construct the skyscraper	A1DP4BJKMEF6LS	3KOPY89HM82MJVNMAC3PTOW3A8Y3J6
0	Jim knew his son was scared of fierce dogs, so he got him a Pomeranian.	A2HM35CWB7IIFM	33FBRBDW6OZLCENMC1HZX1RJ0APC81
1	Jim knew his son was scared of fierce dogs, so he got him a Rottweiler.	A2HM35CWB7IIFM	33FBRBDW6OZLCENMC1HZX1RJ0APC81
0	The man ran past the bus and helped the boy.	A2JBNDG0U9IA6I	3NG53N1RLVJ463WQH635H1QQZSJ8PO
1	The man ran past the bus and kidnapped the boy.	A2JBNDG0U9IA6I	3NG53N1RLVJ463WQH635H1QQZSJ8PO
0	Doug bought a black car to avoid detection of dirt.	A2HM35CWB7IIFM	3JC6VJ2SABJEWH7MUPE5FMR4YH6A5Y
1	Doug bought a black car to avoid detection by cops.	A2HM35CWB7IIFM	3JC6VJ2SABJEWH7MUPE5FMR4YH6A5Y
0	My neighbors gave James gifts for the holiday.	ANVBSQCIBWDO9	3RKNTXVS3MYW0Y3MGKVVAULQYKEA4U
1	My neighbors gave James a live grenade for the holidays.	ANVBSQCIBWDO9	3RKNTXVS3MYW0Y3MGKVVAULQYKEA4U
0	The employee stuffed cookies in their pockets while working the floor.	A2JBNDG0U9IA6I	3WRFBPLXRAOI2LE7PAVHMVDKJS9N30
1	The employee stuffed jewelry down their pants while working the floor.	A2JBNDG0U9IA6I	3WRFBPLXRAOI2LE7PAVHMVDKJS9N30
0	It was illegal to hunt female deer so John made sure the deer he stalked had antlers.	A2HM35CWB7IIFM	3ZOTGHDK5IB44NZYG4WV9SL11IBOS6
1	It was illegal to hunt female deer so John made sure the deer he stalked had fawns.	A2HM35CWB7IIFM	3ZOTGHDK5IB44NZYG4WV9SL11IBOS6
0	Jane tosses scraps of bread to hungry birds at the park.	A2HM35CWB7IIFM	3Z2R0DQ0JHEPNX5BSBETDYEJZME2EL
1	Jane tosses scraps of paper to hungry birds at the park.	A2HM35CWB7IIFM	3Z2R0DQ0JHEPNX5BSBETDYEJZME2EL
0	The girl was using her moms credit card on bread and milk.	A2JBNDG0U9IA6I	34S9DKFK73PJIOBVEVO7CP9XSSJYNU
1	The girl was using her moms credit card on drugs and alcohol.	A2JBNDG0U9IA6I	34S9DKFK73PJIOBVEVO7CP9XSSJYNU
0	He laughed at the antics of the happy monkeys behind the bars.	A2HM35CWB7IIFM	3OVHNO1VE61A12UNLNCNUR65KJ1DZ0
1	He laughed at the antics of the mental patients behind the bars.	A2HM35CWB7IIFM	3OVHNO1VE61A12UNLNCNUR65KJ1DZ0
0	Jeff created a homeless shelter to support the poor	A4T4C70M9RVQG	3OVHNO1VE61A12UNLNCNUR65KIUDZR
1	Jeff created a homeless shelter to scam the poor	A4T4C70M9RVQG	3OVHNO1VE61A12UNLNCNUR65KIUDZR
0	The gang members decided to throw water balloons all over the building.	A2JBNDG0U9IA6I	3LRKMWOKB5HNYSW7OYS6Y8F1NSI2ZM
1	The gang members decided to paint graffiti all over the building.	A2JBNDG0U9IA6I	3LRKMWOKB5HNYSW7OYS6Y8F1NSI2ZM
0	The lady went to the restroom, and the guy watched her bagel.	A6ORRFI3XOACA	39JEC7537U1JNQJZKUS9PFBRB7MVCJ
1	The lady went to the restroom, and the guy lifted her bagel.	A6ORRFI3XOACA	39JEC7537U1JNQJZKUS9PFBRB7MVCJ
0	The lady went to the restroom, and the guy keep an eye out for her money.	A6ORRFI3XOACA	3R8YZBNQ9HIL61SM7EQO36K5T4H7Q9
1	The lady went to the restroom, and the guy lifted her tip.	A6ORRFI3XOACA	3R8YZBNQ9HIL61SM7EQO36K5T4H7Q9
0	Steve only compliments someone when he means it.	A2HM35CWB7IIFM	34FNN24DCM9FSZ5PAVSLI89B18A5Y4
1	Steve only compliments someone when he means to get a favor.	A2HM35CWB7IIFM	34FNN24DCM9FSZ5PAVSLI89B18A5Y4
0	George bought the homeless man's food.	ANVBSQCIBWDO9	3JMSRU9HQIUYKO3DGLY4F3BUWJBEV7
1	George spit on the homeless man's food.	ANVBSQCIBWDO9	3JMSRU9HQIUYKO3DGLY4F3BUWJBEV7
0	Heather asked her children to set the table for dinner.	A3T8THFPERMABH	37XITHEISW9RUJ2IBANZOIMOQ1VCRT
1	Heather screamed at her children to set the table for dinner.	A3T8THFPERMABH	37XITHEISW9RUJ2IBANZOIMOQ1VCRT
0	John covered his mouth when he coughed at the daycare.	A2HM35CWB7IIFM	3EG49X351UCMBYFTAIGOR0G2VXQX65
1	John covered his eyes when he coughed at the daycare.	A2HM35CWB7IIFM	3EG49X351UCMBYFTAIGOR0G2VXQX65
0	She retrieved his glasses that fell on the ground.	A259AXODQQ0WUJ	37UQDCYH6XVDB9O3TDKY9TJDAWAV75
1	She stomped his glasses that fell on the ground.	A259AXODQQ0WUJ	37UQDCYH6XVDB9O3TDKY9TJDAWAV75
0	The young child stole the show at the talent show.	A2HUJ0TBVDOE71	3A0EX8ZRN8OHHFMYB5JYLU93B35BYI
1	The young child stole the audio equipment at the talent show.	A2HUJ0TBVDOE71	3A0EX8ZRN8OHHFMYB5JYLU93B35BYI
0	Jeff suggested Jerry to bungee jump from the top of the canyon	A4T4C70M9RVQG	31QNSG6A5RTF0XSQLK9OHFZ5ZZP78U
1	Jeff forced Jerry to jump from the top of a canyon	A4T4C70M9RVQG	31QNSG6A5RTF0XSQLK9OHFZ5ZZP78U
0	As he slept in the other room, his roommate opened a soda.	A6ORRFI3XOACA	3KAKFY4PGU2QOK3GSUIPHNH3XS23IL
1	As he slept in the other room, his roommate opened another's package.	A6ORRFI3XOACA	3KAKFY4PGU2QOK3GSUIPHNH3XS23IL
0	To keep her quiet in church, the man hummed a song.	A259AXODQQ0WUJ	37ZHEEHM6WMTZ0MK93ESQYRUJDA73F
1	To keep her quiet in church, the man used duck tape.	A259AXODQQ0WUJ	37ZHEEHM6WMTZ0MK93ESQYRUJDA73F
0	The girl ignored her mother when she asked for help.	A3JW0CE3J8EYUQ	3QIYRE09Y3HMSI0S26HYY2YNL7EN1P
1	The girl helped her mother bring the groceries inside.	A3JW0CE3J8EYUQ	3QIYRE09Y3HMSI0S26HYY2YNL7EN1P
0	Sergey parks his car in his assigned spot in the university lot.	A290VJZMR6EA33	3X1FV8S5JXRW42Z4MGOSF6W690CGVE
1	Sergey parks his car across two parking spots in the university lot.	A290VJZMR6EA33	3X1FV8S5JXRW42Z4MGOSF6W690CGVE
0	Adam gave his four year old daughter a chocolate bar for dessert.	A2KAGFQU28JY43	304SM51WA34KLTAPCZR938L2UI3SBF
1	Adam gave his four year old daughter a chocolate bar for dinner.	A2KAGFQU28JY43	304SM51WA34KLTAPCZR938L2UI3SBF
0	Jill copied the story and turned it in as a handwriting exercise.	A2HM35CWB7IIFM	3FTYUGLFSULCUOAYEZ575NZAJKZ5DR
1	Jill copied the story and turned it in as her own.	A2HM35CWB7IIFM	3FTYUGLFSULCUOAYEZ575NZAJKZ5DR
0	He gave his young son the job of raking to teach him responsibility.	A2HM35CWB7IIFM	336KAV9KYQSNT2M2SCQNK16ZHY5Y2I
1	He gave his young son the job of driving to teach him responsibility.	A2HM35CWB7IIFM	336KAV9KYQSNT2M2SCQNK16ZHY5Y2I
0	To get a good grade, the high school student studied hard for the exam.	A3T8THFPERMABH	3TXWC2NHNZQ1X0VSEFDDC2QC6JYS95
1	To get a good grade, the high school student looked at his neighbor's exam paper.	A3T8THFPERMABH	3TXWC2NHNZQ1X0VSEFDDC2QC6JYS95
0	The security guard followed the teens around the store because they were acting suspicious.	A259AXODQQ0WUJ	3E47SOBEYQWE1KZZLNTQAQLX36XICI
1	The security guard followed the teens around the store because they were black.	A259AXODQQ0WUJ	3E47SOBEYQWE1KZZLNTQAQLX36XICI
0	She videotaped her boyfriend opening present.	A2Y5ZQV27N0D0Z	3PXX5PX6LXYGLXOVVZ5II8RW8DOBAW
1	She videotaped her boyfriend in the shower.	A2Y5ZQV27N0D0Z	3PXX5PX6LXYGLXOVVZ5II8RW8DOBAW
0	The girl's Halloween costume was so good that he gave her a lot of candy.	AYTH0E5PUXWX8	39JEC7537U1JNQJZKUS9PFBRB7ZVCW
1	The girl's Halloween costume was so good that he gave her a lot of garbage.	AYTH0E5PUXWX8	39JEC7537U1JNQJZKUS9PFBRB7ZVCW
0	He sincerely apologized for kicking the ball at the ladies backside.	A2JBNDG0U9IA6I	3X66WABAJWICSTXL26IMWB4NIF23GL
1	He refused to apologize for slapping the lady on the backside.	A2JBNDG0U9IA6I	3X66WABAJWICSTXL26IMWB4NIF23GL
0	As he slept in the other room, his roommate opened a TV dinner.	A6ORRFI3XOACA	324G5B4FB38XI8NNQGW9O0TNG0570X
1	As he slept in the other room, his roommate opened a recreational blunt.	A6ORRFI3XOACA	324G5B4FB38XI8NNQGW9O0TNG0570X
0	She removed a red sock from her roommate's white laundry.	A259AXODQQ0WUJ	3M68NM076H72E2TH1JAW2IUEUFDR69
1	She added a red sock to her roommates white laundry.	A259AXODQQ0WUJ	3M68NM076H72E2TH1JAW2IUEUFDR69
0	Jane admired the butterfly's colors so she painted its wings.	A2HM35CWB7IIFM	36TFCYNS44A28NZA617SOR5S4B2XH2
1	Jane admired the butterfly's colors so she pulled off its wings.	A2HM35CWB7IIFM	36TFCYNS44A28NZA617SOR5S4B2XH2
0	As he slept in the other room, his roommate opened one of hid own gifts.	A6ORRFI3XOACA	3QEMNNSB2XZRHSOH2SK437D6APHD7Z
1	As he slept in the other room, his roommate opened one of his gifts.	A6ORRFI3XOACA	3QEMNNSB2XZRHSOH2SK437D6APHD7Z
0	Dan's wife works hard at the office, so he helps her clean the house when she comes home.	A2HM35CWB7IIFM	3ZOTGHDK5IB44NZYG4WV9SL11IDSOC
1	Dan's wife works hard at the office, so he watches her clean the house when she comes home.	A2HM35CWB7IIFM	3ZOTGHDK5IB44NZYG4WV9SL11IDSOC
0	Jim didn't really want his girlfriend to enter the race, but he gave her new running shoes.	A2HM35CWB7IIFM	3PEIJLRY6TTK5DUZ10TSPUFFJZKXW7
1	Jim didn't really want his girlfriend to enter the race, so he hid her new running shoes.	A2HM35CWB7IIFM	3PEIJLRY6TTK5DUZ10TSPUFFJZKXW7
0	Since John missed class, he asked Sally to help him with question #4.	A363NKR14886XG	3X4MXAO0BGO08H8NS1N00CTRIH4RW8
1	Since John missed class, he asked Sally if he could copy her answer to question #4.	A363NKR14886XG	3X4MXAO0BGO08H8NS1N00CTRIH4RW8
0	The lady went to the restroom, and the guy paid her check.	A6ORRFI3XOACA	3WEV0KO0OMSD0Q89QVIFYY92X36SDD
1	The lady went to the restroom, and the guy lifted her payment.	A6ORRFI3XOACA	3WEV0KO0OMSD0Q89QVIFYY92X36SDD
0	The singer touched his drummers arm live on TV.	A2JBNDG0U9IA6I	3C6FJU71TQTWDEV4BW0TQK1R0PXUY5
1	The singer touched his private area live on TV.	A2JBNDG0U9IA6I	3C6FJU71TQTWDEV4BW0TQK1R0PXUY5
0	When the goldfish jumped from the bowl, Tim caught it midair and put it back.	A2HM35CWB7IIFM	3137ONMDKG5F2RDIRQZIF28K95JGEI
1	When the goldfish jumped from the bowl, Tim caught it midair and put it down the drain.	A2HM35CWB7IIFM	3137ONMDKG5F2RDIRQZIF28K95JGEI
0	When Jane saw the new girl sitting alone in the cafeteria, she sat down by her.	A2HM35CWB7IIFM	37QW5D2ZRGM1JVCI9N7ZC6V1MDBS8B
1	When Jane saw the new girl sitting alone in the cafeteria, she kept walking past her.	A2HM35CWB7IIFM	37QW5D2ZRGM1JVCI9N7ZC6V1MDBS8B
0	He woke up to music playing from his alarm clock.	A6ORRFI3XOACA	3ZWFC4W1UU7YXVMS2CD0WO7RNF2RF0
1	He woke up to music playing across the hall.	A6ORRFI3XOACA	3ZWFC4W1UU7YXVMS2CD0WO7RNF2RF0
0	Jeff put his baby under the care of his wife	A4T4C70M9RVQG	3DZQRBDBSLFFIY6CX6C3LPNQ6RB3SM
1	Jeff left his baby in the car unattended	A4T4C70M9RVQG	3DZQRBDBSLFFIY6CX6C3LPNQ6RB3SM
0	Sally cried when the heroine in the story lost her battle with cancer.	A2HM35CWB7IIFM	3Z2R0DQ0JHEPNX5BSBETDYEJZMAE2T
1	Sally chuckled when the heroine in the story lost her battle with cancer.	A2HM35CWB7IIFM	3Z2R0DQ0JHEPNX5BSBETDYEJZMAE2T
0	The neighbor boy did a good job mowing, so Jim paid him twenty dollars.	A2HM35CWB7IIFM	3K9FOBBF2HJZIP4WVGZHIH71JE0NLE
1	The neighbor boy did a good job mowing, so Jim paid him twenty cents.	A2HM35CWB7IIFM	3K9FOBBF2HJZIP4WVGZHIH71JE0NLE
0	Josh slipped an apple from the grocery store into his pocket after paying	A4T4C70M9RVQG	33L7PJKHCGY2YVPXYNCPMBRNOWH8T8
1	Josh slipped an apple from the grocery store into his pocket without paying	A4T4C70M9RVQG	33L7PJKHCGY2YVPXYNCPMBRNOWH8T8
0	The man continued to talk to the boys with a firm voice.	A2JBNDG0U9IA6I	339ANSOTR52WKIBND0AOY9Y58F2KIT
1	The man continued to whip the boys with an oversized stick.	A2JBNDG0U9IA6I	339ANSOTR52WKIBND0AOY9Y58F2KIT
0	Sam couldn't afford to buy a Christmas tree in a lot, so he went to his woods and cut one down.	A2HM35CWB7IIFM	32EYX73OY09NGDJIX18ZIO8UX2PRU7
1	Sam couldn't afford to buy a Christmas tree in a lot, so he went to his neighbor's yard and cut one down.	A2HM35CWB7IIFM	32EYX73OY09NGDJIX18ZIO8UX2PRU7
0	He drove his car to his parents house.	A2D29YTN8FLONY	3YDTZAI2WXG06AQMK122ZTSNUQI41A
1	He drove his car into his parents house.	A2D29YTN8FLONY	3YDTZAI2WXG06AQMK122ZTSNUQI41A
0	John stepped on the brake when he saw the dog in the road.	A2HM35CWB7IIFM	3B837J3LDOW710RE8WDZ3NQ6C5YRSL
1	John stepped on the gas when he saw the dog in the road.	A2HM35CWB7IIFM	3B837J3LDOW710RE8WDZ3NQ6C5YRSL
0	While her parents were resting, she danced outside.	A6ORRFI3XOACA	3EF8EXOTT1VQ9S97N8P65VH6COZJ19
1	While her parents were resting, she snuck out.	A6ORRFI3XOACA	3EF8EXOTT1VQ9S97N8P65VH6COZJ19
0	When he went to the lighthouse he necessarily checked the light source.	AMI8H1U9OH4SM	3KRVW3HTZNLG4KEM3OHIHOWW6HISMF
1	When he went to the lighthouse he neglected to check the light source.	AMI8H1U9OH4SM	3KRVW3HTZNLG4KEM3OHIHOWW6HISMF
0	He tucked his favorite red wine in the wine cellar	A4T4C70M9RVQG	3L70J4KAZGM90UMF9VWODYFWBXNDAQ
1	He tucked the convicting evidence in the wine cellar	A4T4C70M9RVQG	3L70J4KAZGM90UMF9VWODYFWBXNDAQ
0	Jeff drove the vehicle along the barrier next to the road	A4T4C70M9RVQG	34HJIJKLP5WGSM6KRFMR6HZ3JUV4V5
1	Jeff purposefully crashed the vehicle into the barrier next to the road	A4T4C70M9RVQG	34HJIJKLP5WGSM6KRFMR6HZ3JUV4V5
0	The homeowner attacked the home invader.	A2HUJ0TBVDOE71	3TMFV4NEP8EUQCTRTSH09VYMSPL8WI
1	The invader attacked the homeowner.	A2HUJ0TBVDOE71	3TMFV4NEP8EUQCTRTSH09VYMSPL8WI
0	As he slept in the other room, his roommate opened a map.	A6ORRFI3XOACA	3DIP6YHAPCS09C708SNUNPRMLMT8EH
1	As he slept in the other room, his roommate opened his certified mail.	A6ORRFI3XOACA	3DIP6YHAPCS09C708SNUNPRMLMT8EH
0	As he slept in the other room, his roommate opened a card.	A6ORRFI3XOACA	3JRJSWSMQHLE8F1UWBSYW8JB5ZSE3K
1	As he slept in the other room, his roommate opened a can of Whoop-ass.	A6ORRFI3XOACA	3JRJSWSMQHLE8F1UWBSYW8JB5ZSE3K
0	Jeff told Jerry to end his drug addiction	A4T4C70M9RVQG	3907X2AHF05TKOU11PU47ADNDT32PT
1	Jeff told Jerry to end it all with a drug	A4T4C70M9RVQG	3907X2AHF05TKOU11PU47ADNDT32PT
0	He decided to start a book club with his friends.	AYTH0E5PUXWX8	3RRCEFRB7MC1J88EMYVR555WG25B4W
1	He decided to start a fight club with his friends.	AYTH0E5PUXWX8	3RRCEFRB7MC1J88EMYVR555WG25B4W
0	My mother ran over a pot hole with her car.	A1VRQ82Q342D4Y	3X66WABAJWICSTXL26IMWB4NIFM3G5
1	My mother ran over a construction worker with her car.	A1VRQ82Q342D4Y	3X66WABAJWICSTXL26IMWB4NIFM3G5
0	The stray cat was starving, so Johnny fed it his sandwich.	A2HM35CWB7IIFM	3YJ6NA41JBGTQKS98A0W6RZ4F4YPJC
1	The stray cat was starving, so Johnny fed it his homework.	A2HM35CWB7IIFM	3YJ6NA41JBGTQKS98A0W6RZ4F4YPJC
0	Jill had a sunburn, so Jim gently put his arm around her.	A2HM35CWB7IIFM	3JAOYWH7VI4ETN02U6GC0GCHEPL9L3
1	Jill had a sunburn, so Jim flung his arm around her.	A2HM35CWB7IIFM	3JAOYWH7VI4ETN02U6GC0GCHEPL9L3
0	Jim votes in every election to help his candidate win.	A2HM35CWB7IIFM	3PMBY0YE273LQJ6WHTNDXXMUKGAC9T
1	Jim casts two votes in every election to help his candidate win.	A2HM35CWB7IIFM	3PMBY0YE273LQJ6WHTNDXXMUKGAC9T
0	The team was performing well and working hard so the boss gave them bonuses.	AYTH0E5PUXWX8	35K3O9HUABD9ORHNG6T0XH888PPFEM
1	The team was performing well and working hard so the boss fired them all.	AYTH0E5PUXWX8	35K3O9HUABD9ORHNG6T0XH888PPFEM
0	She returned the extra dollar the cashier gave her by mistake.	A259AXODQQ0WUJ	3OONKJ5DKCJ5N1IW5IA0J3B1XT5OBJ
1	She kept the extra dollar the cashier gave her by mistake.	A259AXODQQ0WUJ	3OONKJ5DKCJ5N1IW5IA0J3B1XT5OBJ
0	The crossing guard warned them it was not safe to walk yet.	A3JW0CE3J8EYUQ	3Z9WI9EOZZOWON037IS3YXXQ815HKD
1	The crossing guard left his post early because he was bored.	A3JW0CE3J8EYUQ	3Z9WI9EOZZOWON037IS3YXXQ815HKD
0	My brother crushed a lightbulb with his foot.	A1VRQ82Q342D4Y	3R5F3LQFV2K15ZLCBWQ35LI4OWCOZA
1	My brother crushed a snail with his foot.	A1VRQ82Q342D4Y	3R5F3LQFV2K15ZLCBWQ35LI4OWCOZA
0	The politician took the advice for voting on the new bill.	A2JBNDG0U9IA6I	31Z0PCVWUKFYYHKEOIKJ8BVSDCHT7C
1	The politician took the bribe for voting on the new bill.	A2JBNDG0U9IA6I	31Z0PCVWUKFYYHKEOIKJ8BVSDCHT7C
0	Jeff tore apart his set of BBQ ribs	A4T4C70M9RVQG	3HMVI3QICJSG4H4698Q9FIWUPST1Y6
1	Jeff tore apart Jerry's set of ribs	A4T4C70M9RVQG	3HMVI3QICJSG4H4698Q9FIWUPST1Y6
0	Jeff cut himself off from a unhealthy relationship	A4T4C70M9RVQG	3VFJCI1K4ZZ4BVINDWJIE973OTTGRD
1	Jeff cut himself off after taking advantage of their relationship	A4T4C70M9RVQG	3VFJCI1K4ZZ4BVINDWJIE973OTTGRD
0	Sid knew Mary had just lost her beloved cat, so he gave her a kitten.	A2HM35CWB7IIFM	3RRCEFRB7MC1J88EMYVR555WG3U4BG
1	Sid knew Mary had just lost her beloved cat, so he gave her cat food.	A2HM35CWB7IIFM	3RRCEFRB7MC1J88EMYVR555WG3U4BG
0	Jeff suggested Jerry to eat a delicious gala apple	A4T4C70M9RVQG	3LO69W1SU3DT8XNA8CMMSXY4I26LGW
1	Jeff forced Jerry to eat a delicious gala apple	A4T4C70M9RVQG	3LO69W1SU3DT8XNA8CMMSXY4I26LGW
0	Jill admired the sweater so she asked to borrow it.	A2HM35CWB7IIFM	317HQ483I7SXSOWQAD24Q1F92A7NI1
1	Jill admired the sweater so she took it without asking.	A2HM35CWB7IIFM	317HQ483I7SXSOWQAD24Q1F92A7NI1
0	As he slept in the other room, his roommate opened a banana.	A6ORRFI3XOACA	3WR9XG3T63BEHW5O9HJB03J0XDT74N
1	As he slept in the other room, his roommate opened his letter.	A6ORRFI3XOACA	3WR9XG3T63BEHW5O9HJB03J0XDT74N
0	As he slept in the other room, his college roommate opened a soda can.	A6ORRFI3XOACA	33CUSNVVNNCJ0BX9VP1UVFV0AIS88D
1	As he slept in the other room, his college roommate opened a beer can.	A6ORRFI3XOACA	33CUSNVVNNCJ0BX9VP1UVFV0AIS88D
0	Jill knew her hard-working husband loved sports, so she turned on the ballgame when they sat down to watch TV.	A2HM35CWB7IIFM	3D4CH1LGEATY7VM1JFJWNO79I8WG91
1	Jill knew her hard-working husband loved sports, so she turned on the soap opera when they sat down to watch TV.	A2HM35CWB7IIFM	3D4CH1LGEATY7VM1JFJWNO79I8WG91
0	Jenny wanted to buy a doll so she broke open her piggy bank.	A2HM35CWB7IIFM	3R8YZBNQ9HIL61SM7EQO36K5T5NQ70
1	Jenny wanted to buy a doll so she broke open her brother's piggy bank.	A2HM35CWB7IIFM	3R8YZBNQ9HIL61SM7EQO36K5T5NQ70
0	Joe knows his roommate is a vegetarian, so Joe prepares him soy burgers.	A2HM35CWB7IIFM	3I3WADAZ9Q43YL1N48JNGHB9NYD5OV
1	Joe knows his roommate is a vegetarian, so Joe prepares him sirloin burgers.	A2HM35CWB7IIFM	3I3WADAZ9Q43YL1N48JNGHB9NYD5OV
0	The drug dealer was using his own car to deliver the products.	A2JBNDG0U9IA6I	39DD6S19JPBFT88NHIN709OQKULZEW
1	The drug dealer was using the kids to deliver the products.	A2JBNDG0U9IA6I	39DD6S19JPBFT88NHIN709OQKULZEW
0	He woke up to a huge zit on his face.	A6ORRFI3XOACA	39GHHAVOMFR71R6QAQ883TO9O8UJ47
1	He woke up to a his face being shaved.	A6ORRFI3XOACA	39GHHAVOMFR71R6QAQ883TO9O8UJ47
0	The nanny read the toddler a bed time story.	A2KAGFQU28JY43	3WZ36BJEV3GL0TN41ZWZDDHOW1ITB6
1	The nanny read the toddler an adult novel.	A2KAGFQU28JY43	3WZ36BJEV3GL0TN41ZWZDDHOW1ITB6
0	They had to make an insurance claim to collect the cash payout.	A2JBNDG0U9IA6I	33LKR6A5KEKKNV5CZ23A714FAPW1T0
1	They faked an insurance claim to collect the cash payout.	A2JBNDG0U9IA6I	33LKR6A5KEKKNV5CZ23A714FAPW1T0
0	While her parents were resting, she bathe.	A6ORRFI3XOACA	3II4UPYCOJ71NATWYRTA3YU1FGUQDX
1	While her parents were resting, she partied.	A6ORRFI3XOACA	3II4UPYCOJ71NATWYRTA3YU1FGUQDX
0	The attic contained his daughter's old doll.	AMI8H1U9OH4SM	3JBT3HLQF82JQZXDQW3IULNUY1TZPN
1	The attic contained his daughter's old body.	AMI8H1U9OH4SM	3JBT3HLQF82JQZXDQW3IULNUY1TZPN
0	The teacher was asking the student to meet after school at the library.	A2JBNDG0U9IA6I	3Y54SXRO1LL0WSWA1QDUI39CLMUUTT
1	The teacher was asking the student to meet after school at his house.	A2JBNDG0U9IA6I	3Y54SXRO1LL0WSWA1QDUI39CLMUUTT
0	Sam knew his wife loved the color red so he gave her red roses.	A2HM35CWB7IIFM	3I3WADAZ9Q43YL1N48JNGHB9NY3O54
1	Sam knew his wife loved the color red so he gave her black roses.	A2HM35CWB7IIFM	3I3WADAZ9Q43YL1N48JNGHB9NY3O54
0	As he slept in the other room, his roommate opened a Bible.	A6ORRFI3XOACA	3J4Q2Z4UTY30WGTNFMY0VMJMMVHQWL
1	As he slept in the other room, his roommate opened his Playboy.	A6ORRFI3XOACA	3J4Q2Z4UTY30WGTNFMY0VMJMMVHQWL
0	John tossed a rope to the man who fell through the ice.	A2HM35CWB7IIFM	3X87C8JFV6B7PZCEVHOZYXG1GJ3QSQ
1	John tossed a rock to the man who fell through the ice.	A2HM35CWB7IIFM	3X87C8JFV6B7PZCEVHOZYXG1GJ3QSQ
0	Mike was longing for ice cream at midnight.	A1VRQ82Q342D4Y	39K0FND3AHFC4OSSMOVRWO2QKCXAMP
1	Mike was longing for hookers at midnight.	A1VRQ82Q342D4Y	39K0FND3AHFC4OSSMOVRWO2QKCXAMP
0	As he slept in the other room, his roommate opened a container.	A6ORRFI3XOACA	3MB8LZR5BFTYAJJTY371QPQXPIJLKT
1	As he slept in the other room, his roommate rolled a recreational weed.	A6ORRFI3XOACA	3MB8LZR5BFTYAJJTY371QPQXPIJLKT
0	As his parents rested, he went grocery shopping.	A6ORRFI3XOACA	36WLNQG78ZAJBA57B474ERHNTSVBE0
1	As his parents rested, he went hunting.	A6ORRFI3XOACA	36WLNQG78ZAJBA57B474ERHNTSVBE0
0	The church defended the priest after baptising the little boys.	A2JBNDG0U9IA6I	3PM8NZGV8YGFLGYDPRUMX5XTVYYQXR
1	The church defended the priest after touching the little boys.	A2JBNDG0U9IA6I	3PM8NZGV8YGFLGYDPRUMX5XTVYYQXR
0	"He waved his hand and said ""Sit down."""	A3PRQ2GSU42718	3E337GFOL98JWXQVKP215P2TNW2GNN
1	"He waved his gun and said ""Sit down."""	A3PRQ2GSU42718	3E337GFOL98JWXQVKP215P2TNW2GNN
